[
    {
        "id": "command-library",
        "title": "IT Command Library",
        "provider": "MJ Tech Hub",
        "description": "Essential commands for daily IT operations, automation, and troubleshooting across Windows, Linux, and Networking.",
        "category": "Commands",
        "type": "Interactive Reference",
        "url": "commands.html",
        "tags": "cli, terminal, bash, powershell, cmd, ping, ipconfig, netstat",
        "status": "available"
    },
    {
        "id": "networking-tutorials",
        "title": "Networking Tutorial Library",
        "provider": "MJ Tech Hub",
        "description": "In-depth tutorials covering TCP/IP, OSI model, IP addressing, DNS, DHCP, VLANs, routing, switching, and diagnostics.",
        "category": "Networking",
        "type": "Curriculum",
        "url": "networking.html",
        "tags": "networking, ip, dns, dhcp, vlan, bgp, ospf, routing, switching",
        "status": "available"
    },
    {
        "id": "it-topics",
        "title": "IT Knowledge Topics",
        "provider": "MJ Tech Hub",
        "description": "Comprehensive knowledge base across Networking, Windows, Linux, Servers, Cybersecurity, and Cloud.",
        "category": "General IT",
        "type": "Topic Directory",
        "url": "topics.html",
        "tags": "topics, windows, linux, servers, security, cloud",
        "status": "available"
    },
    {
        "id": "practice-quizzes",
        "title": "IT Practice Quizzes",
        "provider": "MJ Tech Hub",
        "description": "Interactive quizzes to test and validate your knowledge in networking and systems administration.",
        "category": "Assessment",
        "type": "Interactive Quiz",
        "url": "quiz.html",
        "tags": "quiz, test, certification, exam, prep, questions",
        "status": "available"
    },
    {
        "id": "networking-cheat-sheet",
        "title": "Networking Cheat Sheet",
        "provider": "MJ Tech Hub",
        "description": "Quick-reference guide for subnet masks, CIDR notations, common port numbers, and protocol numbers.",
        "category": "Networking",
        "type": "Cheat Sheet",
        "url": "resources.html#networking-cheat-sheet",
        "tags": "subnetting, cidr, ports, protocol, reference, pdf",
        "status": "coming-soon"
    },
    {
        "id": "windows-command-reference",
        "title": "Windows Command Reference",
        "provider": "MJ Tech Hub",
        "description": "Comprehensive reference covering essential CMD, PowerShell, and Sysinternals utility syntax and examples.",
        "category": "Windows",
        "type": "Cheat Sheet",
        "url": "resources.html#windows-command-reference",
        "tags": "windows, cmd, powershell, sysinternals, admin, reference",
        "status": "coming-soon"
    },
    {
        "id": "linux-command-reference",
        "title": "Linux Command Reference",
        "provider": "MJ Tech Hub",
        "description": "Quick reference for Linux filesystem navigation, file permissions (chmod/chown), process management, and network utilities.",
        "category": "Linux",
        "type": "Cheat Sheet",
        "url": "resources.html#linux-command-reference",
        "tags": "linux, bash, shell, permissions, systemd, networking",
        "status": "coming-soon"
    },
    {
        "id": "troubleshooting-checklists",
        "title": "Network & Systems Troubleshooting Checklists",
        "provider": "MJ Tech Hub",
        "description": "Step-by-step methodologies and diagnostic workflows for isolating network latency, packet loss, DNS failures, and host issues.",
        "category": "Troubleshooting",
        "type": "Checklist",
        "url": "resources.html#troubleshooting-checklists",
        "tags": "troubleshooting, checklist, workflow, latency, packet loss, dns",
        "status": "coming-soon"
    },
    {
        "id": "res-ietf-rfc-editor",
        "title": "IETF RFC Editor — Official Internet Standards",
        "provider": "IETF / RFC Editor",
        "description": "The definitive authoritative repository for Request for Comments (RFC) standards governing IP, TCP, UDP, DNS, BGP, and Internet protocols.",
        "category": "Networking",
        "type": "Standard / RFC",
        "url": "https://www.rfc-editor.org/",
        "tags": "ietf, rfc, internet standards, tcp, ip, udp, dns, protocol specifications",
        "status": "available"
    },
    {
        "id": "res-ms-learn-networking",
        "title": "Microsoft Learn — Windows Server Networking",
        "provider": "Microsoft Learn",
        "description": "Official Microsoft enterprise documentation covering TCP/IP stack configuration, Software Defined Networking (SDN), DHCP, and DNS infrastructure.",
        "category": "Networking",
        "type": "Official Documentation",
        "url": "https://learn.microsoft.com/en-us/windows-server/networking/",
        "tags": "microsoft, windows server, networking, sdn, dhcp, dns, enterprise network",
        "status": "available"
    },
    {
        "id": "res-wifi-alliance",
        "title": "Wi-Fi Alliance — Wireless Standards & Certifications",
        "provider": "Wi-Fi Alliance",
        "description": "Global network of companies providing definitive Wi-Fi specifications, WPA3 security standards, and Wi-Fi 6/6E/7 technical certification programs.",
        "category": "Networking",
        "type": "Industry Standard / Certification",
        "url": "https://www.wi-fi.org/",
        "tags": "wifi, wireless, wpa3, wifi 6, wifi 7, 802.11, wireless security",
        "status": "available"
    },
    {
        "id": "res-ms-learn-windows",
        "title": "Microsoft Learn — Windows Client & OS Internals",
        "provider": "Microsoft Learn",
        "description": "Authoritative technical guides covering Windows client administration, system internals, security baselines, and deployment architectures.",
        "category": "Windows",
        "type": "Official Documentation",
        "url": "https://learn.microsoft.com/en-us/windows/",
        "tags": "microsoft, windows, client administration, os internals, security baselines",
        "status": "available"
    },
    {
        "id": "res-ms-learn-powershell",
        "title": "Microsoft Learn — PowerShell Documentation & Cmdlets",
        "provider": "Microsoft Learn",
        "description": "Comprehensive cmdlet references, scripting automation guides, language specifications, and administrative modules for PowerShell.",
        "category": "Windows",
        "type": "Reference Guide",
        "url": "https://learn.microsoft.com/en-us/powershell/",
        "tags": "powershell, scripting, automation, cmdlets, cim, wmi, windows administration",
        "status": "available"
    },
    {
        "id": "res-ms-sysinternals",
        "title": "Microsoft Sysinternals Utilities & Documentation",
        "provider": "Microsoft Sysinternals",
        "description": "Definitive guides and tools by Mark Russinovich for advanced Windows troubleshooting, process analysis (ProcMon, Process Explorer), and security.",
        "category": "Windows",
        "type": "Reference Guide",
        "url": "https://learn.microsoft.com/en-us/sysinternals/",
        "tags": "sysinternals, process explorer, procmon, autoruns, troubleshooting, windows diagnostics",
        "status": "available"
    },
    {
        "id": "res-linux-kernel-org",
        "title": "The Linux Kernel Archives",
        "provider": "Linux Kernel Organization",
        "description": "Primary authoritative source for Linux kernel source code trees, release changelogs, architecture documentation, and maintainer guides.",
        "category": "Linux",
        "type": "Official Documentation",
        "url": "https://www.kernel.org/",
        "tags": "linux, kernel, source code, drivers, posix, operating system kernel",
        "status": "available"
    },
    {
        "id": "res-man7-linux-manual",
        "title": "Linux man-pages Project (man7.org)",
        "provider": "Michael Kerrisk / man7.org",
        "description": "Comprehensive online reference manual for Linux system calls, C standard library functions, POSIX compliance, and system administration utilities.",
        "category": "Linux",
        "type": "Reference Guide",
        "url": "https://man7.org/linux/man-pages/",
        "tags": "linux, man pages, manual, system calls, posix, cli utilities, sysadmin",
        "status": "available"
    },
    {
        "id": "res-systemd-io",
        "title": "systemd System and Service Manager Documentation",
        "provider": "systemd Project",
        "description": "Official architectural specifications, unit configuration file directives, journalctl logging references, and boot management for systemd.",
        "category": "Linux",
        "type": "Official Documentation",
        "url": "https://systemd.io/",
        "tags": "systemd, systemctl, journalctl, init, linux services, daemons, cgroups",
        "status": "available"
    },
    {
        "id": "res-ms-learn-winserver",
        "title": "Microsoft Learn — Windows Server Administration",
        "provider": "Microsoft Learn",
        "description": "Technical documentation for Active Directory Domain Services (AD DS), DNS, DHCP, Hyper-V, failover clustering, and storage spaces.",
        "category": "Servers",
        "type": "Official Documentation",
        "url": "https://learn.microsoft.com/en-us/windows-server/",
        "tags": "windows server, active directory, hyper-v, storage spaces, clustering, dns server",
        "status": "available"
    },
    {
        "id": "res-proxmox-ve-docs",
        "title": "Proxmox Virtual Environment Official Documentation",
        "provider": "Proxmox Server Solutions",
        "description": "Complete reference manual covering Proxmox VE hypervisor management, KVM virtualization, LXC containers, ZFS storage, and high availability.",
        "category": "Servers",